{"done":false,"progress_made":true,"summary":"Completed the next unchecked ExecPlan item: defined a versioned Stage-1 schema in `src/tokens/schema.py` with enforced `version=\"remi_tab_v1\"` and `tpq=24`, added default token families, and kept `DescriptorSpec` defaults explicit. Added coverage in `tests/test_schema.py`. Synced tracking docs by checking the corresponding item in `docs/exec/EXECPLAN_stage1.md`, checking `TODO.md` item 1, and appending a dated note to `PROGRESS.md`.","tests_ran":true,"tests_status":"pass","next_step":"Proceed to the next unchecked ExecPlan item: implement interval math helpers (melodic + harmonic reference) with QA vs production behavior.","stop_reason":""}