{"done":false,"progress_made":true,"summary":"Completed the next unchecked ExecPlan item by adding `src/tokens/tokenizer.py` with voice-event parsing/serialization and stream canonicalization helpers, wired `src/tokens/eventizer.py` to emit pitched voice events through canonical serializer ordering, added `tests/test_tokenizer.py`, marked the ExecPlan/TODO item complete, checked CI in TODO, and appended a PROGRESS entry.","tests_ran":true,"tests_status":"pass","next_step":"Do the next unchecked item in `docs/exec/EXECPLAN_stage1.md`: add round-trip tests for pitch reconstruction and `HARM_*` consistency.","stop_reason":""}