{"done":true,"progress_made":true,"summary":"Completed the next unchecked ExecPlan item by adding round-trip pitch reconstruction and HARM consistency tests in tests/test_roundtrip_pitch.py, checking that item in docs/exec/EXECPLAN_stage1.md, syncing TODO.md, and appending PROGRESS.md. Ran the required precheck and full verify command; tests pass (63 passed, 1 skipped).","tests_ran":true,"tests_status":"pass","next_step":"Proceed to the next unchecked ExecPlan item: implement scripts/make_dataset.py basic pipeline.","stop_reason":"completed"}